{"meta":{"schema_version":"1.0.0","model_version":"0.0.0-mock","generated_at":"2026-09-18T20:09:00+00:00","valid_from":"2026-09-19","state":"karnataka","code_system":"mock","is_mock":true,"lead_dates":{"w1":{"start":"2026-09-20","end":"2026-09-26"},"w2":{"start":"2026-09-27","end":"2026-10-03"},"w3":{"start":"2026-10-04","end":"2026-10-10"},"w4":{"start":"2026-10-11","end":"2026-10-17"}}},"forecast":{"area_id":"MOCK-HOB-Kora","name_en":"Kora","level":"panchayat","p_onset":{"w1":0.066,"w2":0.056,"w3":0.03,"w4":0.02},"p_false_onset":{"w1":0.124,"w2":0.096,"w3":0.06,"w4":0.05},"p_dry7":{"w1":0.36,"w2":0.442,"w3":0.48,"w4":0.55},"p_dry14":{"w1":0.144,"w2":0.214,"w3":0.26,"w4":0.31},"p_heavy":{"w1":0.172,"w2":0.12,"w3":0.09,"w4":0.07},"onset_status":"in_season","confidence":"low","lgd_code":null,"parent_id":"MOCK-BLK-Tumakuru","name_kn":"ಕೋರ","district_en":"Tumakuru","centroid":[77.043,13.443],"n_cells":3,"onset_delay_weeks":2.8},"skill":{"bss":{"w1":0.21,"w2":0.12,"w3":0.03,"w4":-0.01},"reference":"per-cell, per-date climatology 1991-2024","roc_auc":0.74,"advisory_horizon_weeks":2},"provenance_summary":"Based on 51 ECMWF ensemble members and 34 years of IMD rainfall for your hobli."}