{"meta":{"schema_version":"1.0.0","model_version":"0.0.0-mock","generated_at":"2026-09-18T20:09:00+00:00","valid_from":"2026-09-19","state":"karnataka","code_system":"mock","is_mock":true,"lead_dates":{"w1":{"start":"2026-09-20","end":"2026-09-26"},"w2":{"start":"2026-09-27","end":"2026-10-03"},"w3":{"start":"2026-10-04","end":"2026-10-10"},"w4":{"start":"2026-10-11","end":"2026-10-17"}}},"forecast":{"area_id":"MOCK-BLK-Tumakuru","name_en":"Tumakuru","level":"block","p_onset":{"w1":0.05,"w2":0.04,"w3":0.03,"w4":0.02},"p_false_onset":{"w1":0.1,"w2":0.08,"w3":0.06,"w4":0.05},"p_dry7":{"w1":0.32,"w2":0.41,"w3":0.48,"w4":0.55},"p_dry14":{"w1":0.12,"w2":0.19,"w3":0.26,"w4":0.31},"p_heavy":{"w1":0.18,"w2":0.12,"w3":0.09,"w4":0.07},"onset_status":"in_season","confidence":"medium","lgd_code":null,"parent_id":null,"name_kn":"ತುಮಕೂರು","district_en":"Tumakuru","centroid":[77.101,13.342],"n_cells":9,"onset_delay_weeks":2.0,"advisories":[{"rule_id":"tumakuru.groundnut.delayed_onset_4w","crop":"groundnut","stage":"pre_sowing","severity":"warn","action_en":"Switch from groundnut to horse gram or foxtail millet","action_kn":"ಶೇಂಗಾ ಬದಲು ಹುರುಳಿ ಅಥವಾ ನವಣೆ ಬಿತ್ತನೆ ಮಾಡಿ","confidence_word_en":"likely","confidence_word_kn":"ಸಾಧ್ಯತೆ ಹೆಚ್ಚು","source":{"doc":"ICAR-CRIDA district agriculture contingency plan","table":"2.1.1","district":"Tumakuru"}}]},"skill":{"bss":{"w1":0.21,"w2":0.12,"w3":0.03,"w4":-0.01},"reference":"per-cell, per-date climatology 1991-2024","roc_auc":0.74,"advisory_horizon_weeks":2},"provenance_summary":"Based on 51 ECMWF ensemble members and 34 years of IMD rainfall for your hobli."}